lang	ad	ad_seconds	wad	wad_seconds	dem	synt_pos	anim	role	anaphor_device	anaphor_form	anaphor_referent	anaphor_start	anaphor_end	anaphor_sentence_transcription	anaphor_sentence_translation	previous_device	previous_form	previous_referent	previous_start	previous_end	previous_mention	previous_sentence_transcription	previous_sentence_translation	previous_explicit_device	previous_explicit_form	previous_explicit_referent	previous_explicit_start	previous_explicit_end	previous_explicit_mention	previous_explicit_sentence_transcription	previous_explicit_sentence_translation	filename	length_words
kna	4	0.5882988925883126	4	0.5882988925883126	PROX	ADNOM	INANIM	secondary character	PROX_NP	mi q'ak xa	hat	169.90947000062442	170.45825628102395	Haa, q'ak xa hagʷɨr [...] mi q'ak xa [R značit] minowdɨ jii xur,	увидев шапку они поняли что это шапка его	NP	q'ak xa	hat	169.13677891782186	169.3211711080361	>1	Haa, q'ak xa hagʷɨr [...] mi q'ak xa [R značit] minowdɨ jii xur,	увидев шапку они поняли что это шапка его	NP	q'ak xa	hat	169.13677891782186	169.3211711080361	>1	Haa, q'ak xa hagʷɨr [...] mi q'ak xa [R značit] minowdɨ jii xur,	увидев шапку они поняли что это шапка его	kna_pears_shk_10.TextGrid	544
kna	12	3.3850574949868246	12	3.3850574949868246	PROX	INDEP	ANIM	protagonist	PROX	minowdɨ	boy	170.7611863078045	171.2397279443129	Haa, q'ak xa hagʷɨr [...] mi q'ak xa [R značit] minowdɨ jii xur,	увидев шапку они поняли что это шапка его	PROX	minowdɨ	boy	167.0117347226324	167.37612881281768	>1	Had waχtinde mi χɨnimešis tinʲa hargʷara minowdɨ q'ak.	в это время те мальчики замечают там его шапку	PROX	minowdɨ	boy	167.0117347226324	167.37612881281768	>1	Had waχtinde mi χɨnimešis tinʲa hargʷara minowdɨ q'ak.	в это время те мальчики замечают там его шапку	kna_pears_shk_10.TextGrid	544
kna	7	2.3461170077561633	7	2.3461170077561633	PROX	ADNOM	ANIM	protagonist	PROX_NP	mi χɨnɨχ	boy	173.58584495206907	174.0380448471183	q'urha q'aara mi χɨnɨχ.	зовут обтратно этого мальчика	PROX	minowdɨ	boy	170.7611863078045	171.2397279443129	>1	Haa, q'ak xa hagʷɨr [...] mi q'ak xa [R značit] minowdɨ jii xur,	увидев шапку они поняли что это шапка его	PROX	minowdɨ	boy	170.7611863078045	171.2397279443129	>1	Haa, q'ak xa hagʷɨr [...] mi q'ak xa [R značit] minowdɨ jii xur,	увидев шапку они поняли что это шапка его	kna_pears_shk_10.TextGrid	544
kna	2	0.8022903185703854	2	0.8022903185703854	DIST	INDEP	ANIM	protagonist	DIST	Ti	boy	174.84033516568869	175.0774108388213	Ti welisopeda ʁad Jawaš haara.	останавливают того который на велосипеде был	PROX_NP	mi χɨnɨχ	boy	173.58584495206907	174.0380448471183	>1	q'urha q'aara mi χɨnɨχ.	зовут обтратно этого мальчика	PROX_NP	mi χɨnɨχ	boy	173.58584495206907	174.0380448471183	>1	q'urha q'aara mi χɨnɨχ.	зовут обтратно этого мальчика	kna_pears_shk_10.TextGrid	544
kna	5	1.014157046178326	5	1.014157046178326	PROX	INDEP	ANIM	protagonist	PROX	Mibɨr	boys	180.38824788943433	180.6604458845125	Mibɨr dülьq'era q'idibɨr dii.	они играясь шли обратно до этого	NP	χɨnɨχ	boys	179.07555110671865	179.374090843256	>1	Q'ak χana q'uˤhuˤra tinbaj q'ɨxtɨbaj χɨnɨχ sabaj χɨnɨχ χana qɨxɨr,	с шапкой идет к нему один из мальчиков , который повзрослее его	NP	χɨnɨχ	boys	179.07555110671865	179.374090843256	>1	Q'ak χana q'uˤhuˤra tinbaj q'ɨxtɨbaj χɨnɨχ sabaj χɨnɨχ χana qɨxɨr,	с шапкой идет к нему один из мальчиков , который повзрослее его	kna_pears_shk_10.TextGrid	544
kna	2	1.7817505472754362	24	10.490108232872814	DIST	ADNOM	ANIM	protagonist	DIST_COMPLEX_NP	ti dagul hɨɨdbaj, χɨˤrbɨr dagul hɨɨd χɨnɨχ	boy	185.5675190716941	188.02608160788404	ti dagul hɨɨdbaj, χɨˤrbɨr dagul hɨɨd χɨnɨχ jii šuw,	тот который груши украл мальчик	ZERO	q'ɨwɨr	boy	183.68918213906835	183.78576852441867	>1	Q'ak q'ɨwɨlcara tine, q'ɨwɨr xelekande,	шапку возвращают , после возвращения	DIST	Ti	boy	174.84033516568869	175.0774108388213	>1	Ti welisopeda ʁad Jawaš haara.	останавливают того который на велосипеде был	kna_pears_shk_10.TextGrid	544
kna	9	1.2767262758130187	9	1.2767262758130187	MED	INDEP	ANIM	protagonist	MED	hanowa	boy	189.30280788369706	189.91744851774453	hanowa xelekande fikr waara:	он потом начинает думать	DIST_COMPLEX_NP	ti dagul hɨɨdbaj, χɨˤrbɨr dagul hɨɨd χɨnɨχ	boy	185.5675190716941	188.02608160788404	>1	ti dagul hɨɨdbaj, χɨˤrbɨr dagul hɨɨd χɨnɨχ jii šuw,	тот который груши украл мальчик	DIST_COMPLEX_NP	ti dagul hɨɨdbaj, χɨˤrbɨr dagul hɨɨd χɨnɨχ	boy	185.5675190716941	188.02608160788404	>1	ti dagul hɨɨdbaj, χɨˤrbɨr dagul hɨɨd χɨnɨχ jii šuw,	тот который груши украл мальчик	kna_pears_shk_10.TextGrid	544
kna	6	1.4356249095251883	6	1.4356249095251883	PROX	INDEP	ANIM	protagonist	PROX	mibɨr	boys	201.94897413045166	202.25190415723222	mibɨr q'udhüra tiь.	они все уходят туда	NP	xibdɨ χɨnχɨs	boys	199.85041539420382	200.51334922092647	>1	xibdɨ χɨnχɨs xib χɨˤr xa hɨwɨr,	дав троим по груше	NP	xibdɨ χɨnχɨs	boys	199.85041539420382	200.51334922092647	>1	xibdɨ χɨnχɨs xib χɨˤr xa hɨwɨr,	дав троим по груше	kna_pears_shk_10.TextGrid	544
kna	5	1.3420142314936356	5	1.3420142314936356	MED	INDEP	ANIM	protagonist	MED	had	boys	203.59391838872585	203.88806783502	Tiь q'idid had bejda tiʔ q'ühura ti ... q'ɨxdɨ baba,	по пути  мимо них проходит тот взрослый дед	PROX	mibɨr	boys	201.94897413045166	202.25190415723222	>1	mibɨr q'udhüra tiь.	они все уходят туда	PROX	mibɨr	boys	201.94897413045166	202.25190415723222	>1	mibɨr q'udhüra tiь.	они все уходят туда	kna_pears_shk_10.TextGrid	544
kna	228	98.23137761638118	228	98.23137761638118	DIST	ADNOM	ANIM	protagonist	DIST_NP	ti ... q'ɨxdɨ baba	man	204.84954139828	206.20175079318446	Tiь q'idid had bejda tiʔ q'ühura ti ... q'ɨxdɨ baba,	по пути  мимо них проходит тот взрослый дед	DIST_NP	Tin bobodidɨs	man	106.06498721125608	106.61816378189882	>1	Tin bobodidɨs χabar adiš.	там дед даже не знает об этом	DIST_NP	Tin bobodidɨs	man	106.06498721125608	106.61816378189882	>1	Tin bobodidɨs χabar adiš.	там дед даже не знает об этом	kna_pears_shk_10.TextGrid	544
kna	7	2.5112460191082846	7	2.5112460191082846	DIST	INDEP	ANIM	protagonist	DIST	tinxa	man	209.64260837190344	209.90602578649523	Hajя tiʔ q'idid tinxa saʔ seq'eč'ur ula saʔ gʲaq'ɨr,	оттуда сюда идя тот тоже спустился сверху вниз смотря	NP	bobodide	man	206.61769839434118	207.13136235279515	>1	bobodide χɨˤrbɨr kʲaq'laad ǯigɨj.	где дед груши собирал	NP	bobodide	man	206.61769839434118	207.13136235279515	>1	bobodide χɨˤrbɨr kʲaq'laad ǯigɨj.	где дед груши собирал	kna_pears_shk_10.TextGrid	544
kna	48	16.84512663063458	48	16.84512663063458	DIST	ADNOM	ANIM	protagonist	DIST_NP	ti χɨnimer	boys	220.73319446565458	221.25563900459494	tinʲa miʔ χɨˤr wiilera, ti χɨnimer bejda tiʔ q'uˤdʁuˤra.	оттуда груши кушая, те мальчики мимо проходят	MED	had	boys	203.59391838872585	203.88806783502	>1	Tiь q'idid had bejda tiʔ q'ühura ti ... q'ɨxdɨ baba,	по пути  мимо них проходит тот взрослый дед	MED	had	boys	203.59391838872585	203.88806783502	>1	Tiь q'idid had bejda tiʔ q'ühura ti ... q'ɨxdɨ baba,	по пути  мимо них проходит тот взрослый дед	kna_pears_shk_10.TextGrid	544
kna	38	13.172860182443173	38	13.172860182443173	PROX	ADNOM	ANIM	protagonist	PROX_NP	Mi bobodidɨs	man	223.0788859689384	224.07109156390078	Mi bobodidɨs hac'ar diš: [mib...] χɨnimeše dagul hɨɨdid χɨˤrbɨr,	этот дед не знает эти мальчики украли груши	DIST	tinxa	man	209.64260837190344	209.90602578649523	>1	Hajя tiʔ q'idid tinxa saʔ seq'eč'ur ula saʔ gʲaq'ɨr,	оттуда сюда идя тот тоже спустился сверху вниз смотря	DIST	tinxa	man	209.64260837190344	209.90602578649523	>1	Hajя tiʔ q'idid tinxa saʔ seq'eč'ur ula saʔ gʲaq'ɨr,	оттуда сюда идя тот тоже спустился сверху вниз смотря	kna_pears_shk_10.TextGrid	544
mhb	4	1.946584302325581	4	1.946584302325581	DIST	INDEP	ANIM	protagonist	DIST	it	man	14.773510059690503	15.188455929778716	wak'ile ca adamilini χazain urgareʡaˤj ittija, ʁʷet'la it,	Пришел один мужчина хозяин наверно был этого,дерева,	ONE_NP	ca adamilini	man	11.948216856001649	12.826925757364922	1	wak'ile ca adamilini χazain urgareʡaˤj ittija, ʁʷet'la it,	Пришел один мужчина хозяин наверно был этого,дерева,	ONE_NP	ca adamilini	man	11.948216856001649	12.826925757364922	1	wak'ile ca adamilini χazain urgareʡaˤj ittija, ʁʷet'la it,	Пришел один мужчина хозяин наверно был этого,дерева,	mhb_pears_abk_1.TextGrid	224
mhb	3	1.6867839913265428	12	5.738544538591594	MED	INDEP	ANIM	protagonist	MED	illizer	man	20.92700046837031	21.42310326585149	karzinkunera lelle illizer,	Корзины тоже были у него,	ZERO	udes	man	19.130459220963857	19.240216477043766	>1	ʁʷet'ičera aqile qʷaˤrʔbe udes.	поднявшись на дерево груши срывать	DIST	it	man	14.773510059690503	15.188455929778716	>1	wak'ile ca adamilini χazain urgareʡaˤj ittija, ʁʷet'la it,	Пришел один мужчина хозяин наверно был этого,дерева,	mhb_pears_abk_1.TextGrid	224
mhb	8	4.509608811119701	8	4.509608811119701	MED	INDEP	INANIM	secondary character	MED	helra	apron	29.481790267340568	29.850574647769058	helra bic'ile,	Его тоже заполнив,	NP	fartukra	apron	24.43217575630772	24.972181456220866	1	fartukra lebre bihuwe hešedi bilhul, q'ʷač'aličul sik'al ʡaˤj.	фартук тоже был завязан отсюда завязывающий, ну с пакетом вещь	NP	fartukra	apron	24.43217575630772	24.972181456220866	1	fartukra lebre bihuwe hešedi bilhul, q'ʷač'aličul sik'al ʡaˤj.	фартук тоже был завязан отсюда завязывающий, ну с пакетом вещь	mhb_pears_abk_1.TextGrid	224
mhb	28	18.648584186271535	58	39.829554706939774	ABOVE	INDEP	ANIM	protagonist	ABOVE	ič' adami	man	61.25265797279126	61.88046947756833	ič' adami qʷaˤrʔbe diq'uwe lewre,	тот мужчина собирал груши,	ZERO	diq'es waʔib	man	42.43063197141056	42.60407378651973	>1	diq'es waʔib,	начал собирать,	MED	illizer	man	20.92700046837031	21.42310326585149	>1	karzinkunera lelle illizer,	Корзины тоже были у него,	mhb_pears_abk_1.TextGrid	224
mhb	24	13.8911408309637	24	13.8911408309637	ABOVE	INDEP	ANIM	protagonist	ABOVE	heč'ili adami	man	75.77161030853203	76.46527616695705	heč'ili adami nara qʷaˤrʔbe diq'uwe lewre ič'e aquw, ʡaˤrq'uwe lewre	а тот мужчина до сих пор груши собирал там на верху,	ABOVE	ič' adami	man	61.25265797279126	61.88046947756833	>1	ič' adami qʷaˤrʔbe diq'uwe lewre,	тот мужчина собирал груши,	ABOVE	ič' adami	man	61.25265797279126	61.88046947756833	>1	ič' adami qʷaˤrʔbe diq'uwe lewre,	тот мужчина собирал груши,	mhb_pears_abk_1.TextGrid	224
mhb	1	1.5785679015256022	1	1.5785679015256022	MED	INDEP	ANIM	protagonist	MED	heldi	boys	102.91337942732535	103.28216380775383	heldi bak'ib kumakis,	они пришли на помощь,	NP	ule	boys	101.00553975756003	101.33481152579975	1	hanna helle χaˤrʔudi lebre igraca buk'uwe ule,	потом там по близости оказались играющиеся дети,	NP	ule	boys	101.00553975756003	101.33481152579975	1	hanna helle χaˤrʔudi lebre igraca buk'uwe ule,	потом там по близости оказались играющиеся дети,	mhb_pears_abk_1.TextGrid	224
mhb	3	0.7779964380187039	3	0.7779964380187039	MED	INDEP	ANIM	protagonist	MED	heldilini	boys	104.06016024577254	104.48162810911938	heldilini darʔile qʷaˤrʔbera,	они собрали груши,	MED	heldi	boys	102.91337942732535	103.28216380775383	>1	heldi bak'ib kumakis,	они пришли на помощь,	MED	heldi	boys	102.91337942732535	103.28216380775383	>1	heldi bak'ib kumakis,	они пришли на помощь,	mhb_pears_abk_1.TextGrid	224
mhb	6	3.263222292848809	12	8.323164221922042	PROX	INDEP	ANIM	protagonist	PROX	išdilis	boys	112.80479233104143	113.32943201510338	ca-ca qaˤrʔra gib išdilis,	по одной груше дал им,	ZERO	watur	boys	109.4362030723559	109.54157003819262	>1	hunew watur,	провели его,	MED	heldilini	boys	104.06016024577254	104.48162810911938	>1	heldilini darʔile qʷaˤrʔbera,	они собрали груши,	mhb_pears_abk_1.TextGrid	224
mhb	1	0.7300637474853602	1	0.7300637474853602	DIST	ADNOM	ANIM	protagonist	DIST_NP	itdi uršbe	boys	114.05949576258874	115.09740324628339	itdi uršbe ʡaˤšbaˤqile	те мальчики возвращаясь	PROX	išdilis	boys	112.80479233104143	113.32943201510338	>1	ca-ca qaˤrʔra gib išdilis,	по одной груше дал им,	PROX	išdilis	boys	112.80479233104143	113.32943201510338	>1	ca-ca qaˤrʔra gib išdilis,	по одной груше дал им,	mhb_pears_abk_1.TextGrid	224
mhb	78	44.688464054690826	78	44.688464054690826	DIST	ADNOM	ANIM	protagonist	DIST_NP	het dadda	man	121.15374022164788	121.74319169982165	ʁʷet'ičebadal... ʁʷet'ičew lewre nara het dadda,	с дерева... на дереве был до сих пор тот дедушка,	ABOVE	heč'ili adami	man	75.77161030853203	76.46527616695705	>1	heč'ili adami nara qʷaˤrʔbe diq'uwe lewre ič'e aquw, ʡaˤrq'uwe lewre	а тот мужчина до сих пор груши собирал там на верху,	ABOVE	heč'ili adami	man	75.77161030853203	76.46527616695705	>1	heč'ili adami nara qʷaˤrʔbe diq'uwe lewre ič'e aquw, ʡaˤrq'uwe lewre	а тот мужчина до сих пор груши собирал там на верху,	mhb_pears_abk_1.TextGrid	224
mhb	1	2.0397833111111936	8	6.591709320022019	DIST	INDEP	ANIM	protagonist	DIST	itize	man	128.33490101984367	128.75617105133628	itize ħabargib karzinka qʷaˤrʔbela,	он не нашел корзинку груш,	ZERO	wak'ibijaʁle,	man	126.24286716219076	126.29511770873248	>1	ketal wak'ibijaʁle,	спустился	DIST_NP	het dadda	man	121.15374022164788	121.74319169982165	>1	ʁʷet'ičebadal... ʁʷet'ičew lewre nara het dadda,	с дерева... на дереве был до сих пор тот дедушка,	mhb_pears_abk_1.TextGrid	224
mhb	29	16.815277084905972	36	19.926983709169292	DIST	ADNOM	ANIM	protagonist	DIST_NP	hetdi ule	boys	135.02438695545268	135.58195381633863	bak'ibʡaˤj hetdi ule ite χaˤrʔudi	пришли те дети оттуда	ZERO	bikib	boys	118.14984095226356	118.20910987054671	>1	bikib hete ʁʷet'la u,	попали под то дерево,	DIST_NP	itdi uršbe	boys	114.05949576258874	115.09740324628339	>1	itdi uršbe ʡaˤšbaˤqile	те мальчики возвращаясь	mhb_pears_abk_1.TextGrid	224
mhb	24	13.238899303495316	24	13.238899303495316	DIST	INDEP	ANIM	protagonist	DIST	itra	man	141.9950703548316	142.58087628907379	ʡaˤraʁa, hete ʡaˤla ħule kalʔunʡaˤj itra,	потом за ними смотря остался он тоже,	DIST	itize	man	128.33490101984367	128.75617105133628	>1	itize ħabargib karzinka qʷaˤrʔbela,	он не нашел корзинку груш,	DIST	itize	man	128.33490101984367	128.75617105133628	>1	itize ħabargib karzinka qʷaˤrʔbela,	он не нашел корзинку груш,	mhb_pears_abk_1.TextGrid	224
mhb	50	31.59220987982789	75	49.589717752633405	DIST	ADNOM	ANIM	protagonist	DIST_NP	it uršira	boy	144.3579234377101	144.8035378973945	it uršira ʡaˤraˤq'un	тот мальчик тоже уехал	ZERO	gib	boy	112.74376210666622	112.76571355788221	>1	ca-ca qaˤrʔra gib išdilis,	по одной груше дал им,	NP	urši	boy	94.28003407320821	94.7682056850767	>1	arikib lisibit'ičela urši,	и упал с велосипеда мальчик,	mhb_pears_abk_1.TextGrid	224
kna	16	6.428744773319394	22	8.846105921954472	MED	INDEP	ANIM	protagonist	MED	hanuw	man	16.55931420410697	16.765657845537195	Wnimanie hɨwɨr diš hanuw šuw haʔarajden.	Не обратил внимание на то, что тот делал	ZERO	kʲaqlawara	man	10.02959275519406	10.130569430787574	>1	Sa edemi χuka leč'ur, χukala χɨˤr kʲaqlawara.	Один человек на дерево залез, с дерева груши срывает.	NP	Sa edemi	man	7.234666645644102	7.713208282152498	1	Sa edemi χuka leč'ur, χukala χɨˤr kʲaqlawara.	Один человек на дерево залез, с дерева груши срывает.	kna_pears_saa_8.TextGrid	158
kna	12	6.337227329334837	12	6.337227329334837	DIST	ADNOM	ANIM	protagonist	DIST_NP	ti edemijes	man	23.102885174872032	23.62532971381239	A u gʲaɢɨr, ti edemijes jüǯ ʁaǯagujne.	Посмотрев вокруг увидев что тот не заметил его	MED	hanuw	man	16.55931420410697	16.765657845537195	>1	Wnimanie hɨwɨr diš hanuw šuw haʔarajden.	Не обратил внимание на то, что тот делал	MED	hanuw	man	16.55931420410697	16.765657845537195	>1	Wnimanie hɨwɨr diš hanuw šuw haʔarajden.	Не обратил внимание на то, что тот делал	kna_pears_saa_8.TextGrid	158
kna	4	2.0107086441267583	4	2.0107086441267583	DIST	ADNOM	ANIM	protagonist	DIST_NP	Ti edemijed	man	25.63603835793915	26.12116542981234	Ti edemijed ala kʲaqlawɨd χɨˤrbɨr ad... kar χaqɨna, qoˤʁoˤra.	того человека снизу с грушами вещь забрав уходит	DIST_NP	ti edemijes	man	23.102885174872032	23.62532971381239	>1	A u gʲaɢɨr, ti edemijes jüǯ ʁaǯagujne.	Посмотрев вокруг увидев что тот не заметил его	DIST_NP	ti edemijes	man	23.102885174872032	23.62532971381239	>1	A u gʲaɢɨr, ti edemijes jüǯ ʁaǯagujne.	Посмотрев вокруг увидев что тот не заметил его	kna_pears_saa_8.TextGrid	158
kna	18	9.686340903120687	39	23.223487656324917	MED	INDEP	ANIM	protagonist	MED	hanowus	boy	47.068920420206126	47.44648538112101	Xibdɨ χɨnχɨra hanowus... kumag hɨɨr, Jahmiš q'ɨɨr χɨˤrbɨˤr tiʔ... tiʔna qaˤtχɨˤr.	три мальчика ему... помогли , собрали груши и туда ушли	ZERO	hukur	boy	37.292578567099916	37.38257951708544	>1	Rɨša hukur,	посмотрев на девушку	SELF	jüǯ	boy	23.693967750490938	23.84543276388121	>1	A u gʲaɢɨr, ti edemijes jüǯ ʁaǯagujne.	Посмотрев вокруг увидев что тот не заметил его	kna_pears_saa_8.TextGrid	158
kna	3	0.7605612252279954	28	15.334314838775526	MED	INDEP	ANIM	protagonist	MED	hanowdɨ	boy	62.780800219896534	63.23739040518895	Jawaš hišijne bejda qɨtxɨr hanowdɨ q'ak qɨwɨlc'ara.	когда остановился близко подошли и отдали ему свою шапку	ZERO	hišijne	boy	61.9456040605342	62.02023899466854	>1	Jawaš hišijne bejda qɨtxɨr hanowdɨ q'ak qɨwɨlc'ara.	когда остановился близко подошли и отдали ему свою шапку	MED	hanowus	boy	47.068920420206126	47.44648538112101	>1	Xibdɨ χɨnχɨra hanowus... kumag hɨɨr, Jahmiš q'ɨɨr χɨˤrbɨˤr tiʔ... tiʔna qaˤtχɨˤr.	три мальчика ему... помогли , собрали груши и туда ушли	kna_pears_saa_8.TextGrid	158
kna	5	2.7065696476733763	5	2.7065696476733763	DIST	INDEP	ANIM	protagonist	DIST	tinowa	boy	65.94396005286232	66.40933081864114	Q'ak qɨwɨrne, tinowa xib χɨˤr wɨlc'ara, xibnowɨs.	вернув шапку, тот дает троим каждому по одной груше	MED	hanowdɨ	boy	62.780800219896534	63.23739040518895	>1	Jawaš hišijne bejda qɨtxɨr hanowdɨ q'ak qɨwɨlc'ara.	когда остановился близко подошли и отдали ему свою шапку	MED	hanowdɨ	boy	62.780800219896534	63.23739040518895	>1	Jawaš hišijne bejda qɨtxɨr hanowdɨ q'ak qɨwɨlc'ara.	когда остановился близко подошли и отдали ему свою шапку	kna_pears_saa_8.TextGrid	158
kna	5	2.2953758532140114	5	2.2953758532140114	DIST	INDEP	ANIM	protagonist	DIST	Tin	boy	68.70470667185515	68.91544060352857	Tin tisana qaˤrχɨˤr mi xibɨr, χɨˤr kʲaq'lawanowdɨ bejda tiь dii.	тот ушел в другую сторону а эти трое проходят мимо того кто срывал груши	DIST	tinowa	boy	65.94396005286232	66.40933081864114	>1	Q'ak qɨwɨrne, tinowa xib χɨˤr wɨlc'ara, xibnowɨs.	вернув шапку, тот дает троим каждому по одной груше	DIST	tinowa	boy	65.94396005286232	66.40933081864114	>1	Q'ak qɨwɨrne, tinowa xib χɨˤr wɨlc'ara, xibnowɨs.	вернув шапку, тот дает троим каждому по одной груше	kna_pears_saa_8.TextGrid	158
kna	4	1.585393140742795	4	1.585393140742795	PROX	ADNOM	ANIM	protagonist	PROX_NP	mi xibɨr	boys	69.82296343309214	70.46175066347722	Tin tisana qaˤrχɨˤr mi xibɨr, χɨˤr kʲaq'lawanowdɨ bejda tiь dii.	тот ушел в другую сторону а эти трое проходят мимо того кто срывал груши	NP	xibnowɨs	boys	67.66902770585543	68.23757029234935	>1	Q'ak qɨwɨrne, tinowa xib χɨˤr wɨlc'ara, xibnowɨs.	вернув шапку, тот дает троим каждому по одной груше	NP	xibnowɨs	boys	67.66902770585543	68.23757029234935	>1	Q'ak qɨwɨrne, tinowa xib χɨˤr wɨlc'ara, xibnowɨs.	вернув шапку, тот дает троим каждому по одной груше	kna_pears_saa_8.TextGrid	158
kna	7	2.6434530893531587	17	10.571935225319706	MED	INDEP	ANIM	protagonist	MED	Hanowus	man	86.75713247796959	87.22030809862682	Hanowus fikɨr wišir,	ему показалось	ZERO	hurkama	man	84.06099590569808	84.11367938861643	>1	Sugubajdɨ kar... Sugud kardi hurkama bejda tiʔ xibɨr q'idi χɨˤr wiilera.	то что потерялось... отвлекшись на потерянное он видит что мимо проходят мальчиков кушая груши	SELF	ǯu	man	75.93934099903089	76.18519725264989	>1	edemi saʔ eqeč'ur gʲahama ǯu kʲaq'lawɨd sabajdɨ kar sugurani jii.	спустившись он видит что олна карзина которую он собрал потерялась	kna_pears_saa_8.TextGrid	158
kna	7	2.8190876429324163	7	2.8190876429324163	MED	ADNOM	ANIM	protagonist	MED_NP	ha xibnuwa	boys	88.40398968211714	88.95936139788148	ha xibnuwa dagul hɨɨr hanuwdɨ χɨˤrbɨr.	что эти трое украли его груши	NP	xibɨr q'idi	boys	85.05587206487957	85.58490203918473	>1	Sugubajdɨ kar... Sugud kardi hurkama bejda tiʔ xibɨr q'idi χɨˤr wiilera.	то что потерялось... отвлекшись на потерянное он видит что мимо проходят мальчиков кушая груши	NP	xibɨr q'idi	boys	85.05587206487957	85.58490203918473	>1	Sugubajdɨ kar... Sugud kardi hurkama bejda tiʔ xibɨr q'idi χɨˤr wiilera.	то что потерялось... отвлекшись на потерянное он видит что мимо проходят мальчиков кушая груши	kna_pears_saa_8.TextGrid	158
kna	7	2.4675021231907124	7	2.4675021231907124	MED	INDEP	ANIM	protagonist	MED	hanuwdɨ	man	89.68781022181753	90.0873266339484	ha xibnuwa dagul hɨɨr hanuwdɨ χɨˤrbɨr.	что эти трое украли его груши	MED	Hanowus	man	86.75713247796959	87.22030809862682	>1	Hanowus fikɨr wišir,	ему показалось	MED	Hanowus	man	86.75713247796959	87.22030809862682	>1	Hanowus fikɨr wišir,	ему показалось	kna_pears_saa_8.TextGrid	158
