lang	ad	ad_seconds	wad	wad_seconds	dem	synt_pos	anim	role	anaphor_device	anaphor_form	anaphor_referent	anaphor_start	anaphor_end	anaphor_sentence_transcription	anaphor_sentence_translation	previous_device	previous_form	previous_referent	previous_start	previous_end	previous_mention	previous_sentence_transcription	previous_sentence_translation	previous_explicit_device	previous_explicit_form	previous_explicit_referent	previous_explicit_start	previous_explicit_end	previous_explicit_mention	previous_explicit_sentence_transcription	previous_explicit_sentence_translation	filename	length_words
mhb	20	9.287353405052428	38	18.56984571219091	MED	ADNOM	ANIM	protagonist	MED_NP	Ilь dadda	man	84.13731837668294	84.61146972294814	Ilь dadda aqilegоʡaˤj ʡaˤraʁallara ič'e aquʡaˤj, ʁʷet'iče.	Тот дедушка поднялся потом ещё раз туда наверх на дерево	ZERO	biq'uwe	man	74.78411061798256	74.84996497163051	>1	Daddajni wahajle akkuratnо ič'ela ketalra asile qʷaˤrʔ, berdi-berdibi qʷaˤrʔgо selize, ca ħunt'al pardawli zurra baq'ile karzinkaleħe birxuwe se biq'uwe.	Дедушка очень аккуратно оттуда вниз тоже спустив грушу, каждую сорванную грушу в это, одним красным платком вытирал в корзинку ставил это делал	NP	Daddajni	man	65.18112712309075	65.56747266449203	>1	Daddajni wahajle akkuratnо ič'ela ketalra asile qʷaˤrʔ, berdi-berdibi qʷaˤrʔgо selize, ca ħunt'al pardawli zurra baq'ile karzinkaleħe birxuwe se biq'uwe.	Дедушка очень аккуратно оттуда вниз тоже спустив грушу, каждую сорванную грушу в это, одним красным платком вытирал в корзинку ставил это делал	mhb_pears_isr_5.TextGrid	210
mhb	9	5.429640998233509	28	19.91632048117154	DIST	INDEP	ANIM	protagonist	DIST	it	boy	108.27130435804433	108.44252567752899	ili dursilini weqʷaqibilю it saʁо uquwe ca ʁarʁalizera, arikib urši qʷaˤrʔbera ardikile.	или девочка отвлекла его как-то  споткнулся об один камень, упал мальчик груши тоже упали(рассыпались)	ZERO	dikile	boy	102.7560527000685	102.84166335981082	>1	ʡaˤrq'ujħer huneče dikile helьоnal lisibit'ičer q'oˤl ca dursira,	По пути когда уезжал встретилась которая так же на велосипеде ехала одна девочка тоже,	COMPLEX_NP	Lisibit'la weʡini	boy	87.43741321604477	88.3549838768728	>1	Lisibit'la weʡini daddala ca karzinka biʡOˤn.	Велосипеда хозяин дедушкину одну корзинку украл	mhb_pears_isr_5.TextGrid	210
mhb	13	8.846811516778928	13	8.846811516778928	PROX	INDEP	ANIM	protagonist	PROX	išra	boy	120.09062712731911	120.39136200897806	ʜaˤbal uršilini qʷaˤrʔbera darA dakib išra waq'ib k'at'ra waq'ile darA dakile qʷaˤrʔbera, ʡaˤraʁallara qʷaˤrʔbera seliče dixile ʡaˤraˤq'un.	Трое ребят груши тоже собрали его тоже вытряхнули собрав груши тоже снова груши тоже на это поставили и уехал	NP	urši	boy	110.96503218009723	111.24381561054018	>1	ili dursilini weqʷaqibilю it saʁо uquwe ca ʁarʁalizera, arikib urši qʷaˤrʔbera ardikile.	или девочка отвлекла его как-то  споткнулся об один камень, упал мальчик груши тоже упали(рассыпались)	NP	urši	boy	110.96503218009723	111.24381561054018	>1	ili dursilini weqʷaqibilю it saʁо uquwe ca ʁarʁalizera, arikib urši qʷaˤrʔbera ardikile.	или девочка отвлекла его как-то  споткнулся об один камень, упал мальчик груши тоже упали(рассыпались)	mhb_pears_isr_5.TextGrid	210
mhb	2	0.4829319267516041	2	0.4829319267516041	MED	INDEP	ANIM	secondary character	MED	hellis	boy1	142.6827224224157	143.08004368942497	Išlaˤpa χile wak'ile, išlaˤpa χile wak'ib ca urši, hellis cacalis ca-ca qʷaˤrʔra gib uršilini.	Шляпу принёс пришёл, шляпу принёс пришёл один из ребят, ему каждому по одной груше тоже дал мальчик	ONE_NP	ca urši	boy1	141.63124790917018	142.1997904956641	1	Išlaˤpa χile wak'ile, išlaˤpa χile wak'ib ca urši, hellis cacalis ca-ca qʷaˤrʔra gib uršilini.	Шляпу принёс пришёл, шляпу принёс пришёл один из ребят, ему каждому по одной груше тоже дал мальчик	ONE_NP	ca urši	boy1	141.63124790917018	142.1997904956641	1	Išlaˤpa χile wak'ile, išlaˤpa χile wak'ib ca urši, hellis cacalis ca-ca qʷaˤrʔra gib uršilini.	Шляпу принёс пришёл, шляпу принёс пришёл один из ребят, ему каждому по одной груше тоже дал мальчик	mhb_pears_isr_5.TextGrid	210
mhb	6	3.5968995060493967	6	3.5968995060493967	MED	INDEP	ANIM	secondary character	MED	Helra	boy1	146.67694319547437	147.0896304783348	Helra ʡaˤraˤq'un, ca ketal wak'ibi heč'edi ketal qʷaˤrʔbera χile wak'ibi hize ħabargib karzinka.	Он тоже ушёл, спустившийся оттуда вниз груши тоже взяв спустившийся он не нашёл корзинку	MED	hellis	boy1	142.6827224224157	143.08004368942497	>1	Išlaˤpa χile wak'ile, išlaˤpa χile wak'ib ca urši, hellis cacalis ca-ca qʷaˤrʔra gib uršilini.	Шляпу принёс пришёл, шляпу принёс пришёл один из ребят, ему каждому по одной груше тоже дал мальчик	MED	hellis	boy1	142.6827224224157	143.08004368942497	>1	Išlaˤpa χile wak'ile, išlaˤpa χile wak'ib ca urši, hellis cacalis ca-ca qʷaˤrʔra gib uršilini.	Шляпу принёс пришёл, шляпу принёс пришёл один из ребят, ему каждому по одной груше тоже дал мальчик	mhb_pears_isr_5.TextGrid	210
mhb	16	5.457154463062722	119	72.92435902761316	MED	ADNOM	ANIM	protagonist	MED_COMPLEX_NP	helь qʷaˤrʔbela weʡra lewre	man	161.9034841794382	163.3391090889634	če ra lewre, helь qʷaˤrʔbela weʡra lewre.	три ли было запутавшийся он тоже был, этот груш хозяин был	ZERO	wilьsq'uwe	man	156.37169478224115	156.4463297163755	>1	ʡaˤraʁa kudawaraw heš bikiba ile, ite wilьsq'uwe iše wilьsq'uwe, hešeb caw buʔubi senela ʜaˤbalu k'ʷijalu ʜaˤbalu buʔubi hajqum uhuble	Потом куда же она пропала думая, туда смотрел сюда смотрел, здесь одна была у меня три ли два ли	NP	daddala	man	88.40838742020954	88.97912515182504	>1	Lisibit'la weʡini daddala ca karzinka biʡOˤn.	Велосипеда хозяин дедушкину одну корзинку украл	mhb_pears_isr_5.TextGrid	210
kna	10	5.243081191878332	10	5.243081191878332	MED	ADNOM	ANIM	protagonist	MED_NP	ha χɨnχɨs	boy	37.30908324432198	37.73933168815522	ǯibraa xibɨr χɨnɨχ jirq'ɨr ha χɨnχɨs Jaʁmiš hɨɨr χɨˤrbɨr xa ara iqixir	потом трое мальчиков пришли этому мальчику собрали груши и поставили	NP	χɨnɨχ	boy	31.727949703717535	32.06600205244365	>1	rɨšed tamaše haat' xur χɨnɨχ jüǯ lukur χɨˤrbɨr saʔ seč'ur	насмотревшись на девушку маьчик падает и груши роняет	NP	χɨnɨχ	boy	31.727949703717535	32.06600205244365	>1	rɨšed tamaše haat' xur χɨnɨχ jüǯ lukur χɨˤrbɨr saʔ seč'ur	насмотревшись на девушку маьчик падает и груши роняет	kna_pears_mgm_2.TextGrid	121
kna	4	1.06200139293135	31	13.866411249306793	PROX	INDEP	ANIM	protagonist	PROX	mibišis	boys	50.68370594623402	51.12273497055365	šapk'a qɨwɨdя quʔ xele χɨnχɨra mibišis xib χɨˤr wɨlc'ara	после того как отдает шапку мальчик дает три груши	ZERO	qɨwɨdя	boys	49.55145990941153	49.62170455330267	>1	šapk'a qɨwɨdя quʔ xele χɨnχɨra mibišis xib χɨˤr wɨlc'ara	после того как отдает шапку мальчик дает три груши	NUM_NP	xibɨr χɨnɨχ	boys	36.17192203117737	36.81729469692723	>1	ǯibraa xibɨr χɨnɨχ jirq'ɨr ha χɨnχɨs Jaʁmiš hɨɨr χɨˤrbɨr xa ara iqixir	потом трое мальчиков пришли этому мальчику собрали груши и поставили	kna_pears_mgm_2.TextGrid	121
kna	14	7.381335913687614	14	7.381335913687614	MED	INDEP	ANIM	protagonist	MED	hanowdɨ	boy	57.62983025614429	58.215934003611	Haя χɨˤrbɨr saʔ leč'ur hanowdɨ.	тогда упали и его груши	ZERP	gɨˤrχɨˤr	boy	50.18483513393033	50.248494342456674	>1	Qaχɨd ǯigij rɨš gɨˤrχɨˤr tinʲaː miʔ wiid welosipedas.	когда убежал встретил девушку на велосипеде	ZERP	gɨˤrχɨˤr	boy	50.18483513393033	50.248494342456674	>1	Qaχɨd ǯigij rɨš gɨˤrχɨˤr tinʲaː miʔ wiid welosipedas.	когда убежал встретил девушку на велосипеде	kna_pears_vdm_3.TextGrid	180
kna	2	2.844800163139638	2	2.844800163139638	MED	INDEP	ANIM	protagonist	MED	hadxa	boy	61.060734166750635	61.43610398254392	Ej, hadxa lurkuraj šuw?	она тоже упала же(говорит кому-то)	MED	hanowdɨ	boy	57.62983025614429	58.215934003611	>1	Haя χɨˤrbɨr saʔ leč'ur hanowdɨ.	тогда упали и его груши	MED	hanowdɨ	boy	57.62983025614429	58.215934003611	>1	Haя χɨˤrbɨr saʔ leč'ur hanowdɨ.	тогда упали и его груши	kna_pears_vdm_3.TextGrid	180
kna	22	13.015581951212688	22	13.015581951212688	MED	INDEP	ANIM	protagonist	MED	hanowdɨ	boy	74.45168593375661	74.96095960196737	sabajnuw χɨˤrbɨr Jahmiš qaaraj hanowdɨ,	один собирал ему груши	MED	hadxa	boy	61.060734166750635	61.43610398254392	>1	Ej, hadxa lurkuraj šuw?	она тоже упала же(говорит кому-то)	MED	hadxa	boy	61.060734166750635	61.43610398254392	>1	Ej, hadxa lurkuraj šuw?	она тоже упала же(говорит кому-то)	kna_pears_vdm_3.TextGrid	180
kna	62	45.06360739084863	98	65.15643784006431	DIST	ADNOM	ANIM	protagonist	DIST_NP	Ti q'aˤsdɨ bobodid	man	84.64629200417608	85.80084604423017	Ti q'aˤsdɨ bobodid haя, uu χukaala saʔ eqeč'ud [ǯi...] ǯigɨj sabajdɨ t'ak madišij.	тот старый дед тогда, сверху с дерева когла спустился одной карзины не осталось	ZERO	ǯigɨj	man	39.50804967919312	39.582684613327444	>1	T'ak ij šuw misad, t'aka Jahmiš hɨɨd ǯigɨj,	карзина же была такая в карзину когда собрал	NP	Sa q'aˤsdɨ bobodide	man	17.926910837533885	19.48985416411176	1	Sa q'aˤsdɨ bobodide χɨˤrbɨr kʲaq'laad ǯigɨj.	один старый дед срывал груши	kna_pears_vdm_3.TextGrid	180
kna	15	6.1297808803855105	15	6.1297808803855105	DIST	ADNOM	ANIM	protagonist	DIST_NP	ti χɨnimer xa	boys	100.56732458668277	101.14903804390629	Я Juǯ halgɨr diš ti χɨnimer xa hatχɨˤr haя tiʔ dülqera.	сам вообще не разговаривал с мальчикам те тоже прошли мимо играясь	COMPLEX_NP	bejda tiʔ diid χɨnimešda	boys	92.90663728793142	94.43754370629726	>1	Haя bejda tiʔ diid χɨnimešda χutkas xud ǯigɨj:	тогда рядом туда проходяших мальчиков спросить решил:	COMPLEX_NP	bejda tiʔ diid χɨnimešda	boys	92.90663728793142	94.43754370629726	>1	Haя bejda tiʔ diid χɨnimešda χutkas xud ǯigɨj:	тогда рядом туда проходяших мальчиков спросить решил:	kna_pears_vdm_3.TextGrid	180
kna	12	5.159204422647932	12	5.159204422647932	DIST	ADNOM	ANIM	protagonist	DIST_NP	ti χɨnimer	boys	106.30824246655422	106.87019961768334	Haя ti χɨnimer diid ǯigɨj rɨˤɢaˤ šlʲapa agɨr habišda.	когда те мальчики шли по дороге находят шляпу они	DIST_NP	ti χɨnimer xa	boys	100.56732458668277	101.14903804390629	>1	Я Juǯ halgɨr diš ti χɨnimer xa hatχɨˤr haя tiʔ dülqera.	сам вообще не разговаривал с мальчикам те тоже прошли мимо играясь	DIST_NP	ti χɨnimer xa	boys	100.56732458668277	101.14903804390629	>1	Я Juǯ halgɨr diš ti χɨnimer xa hatχɨˤr haя tiʔ dülqera.	сам вообще не разговаривал с мальчикам те тоже прошли мимо играясь	kna_pears_vdm_3.TextGrid	180
kna	7	2.0713111056316933	7	2.0713111056316933	DIST	INDEP	ANIM	protagonist	DIST	habišda	boys	108.94151072331503	109.5583465024841	Haя ti χɨnimer diid ǯigɨj rɨˤɢaˤ šlʲapa agɨr habišda.	когда те мальчики шли по дороге находят шляпу они	DIST_NP	ti χɨnimer	boys	106.30824246655422	106.87019961768334	>1	Haя ti χɨnimer diid ǯigɨj rɨˤɢaˤ šlʲapa agɨr habišda.	когда те мальчики шли по дороге находят шляпу они	DIST_NP	ti χɨnimer	boys	106.30824246655422	106.87019961768334	>1	Haя ti χɨnimer diid ǯigɨj rɨˤɢaˤ šlʲapa agɨr habišda.	когда те мальчики шли по дороге находят шляпу они	kna_pears_vdm_3.TextGrid	180
kna	61	36.109826268752855	61	36.109826268752855	DIST	ADNOM	ANIM	protagonist	DIST_NP	ti χɨnɨχ	boy	111.07078587072023	111.56249837795822	Süt hawɨr ti χɨnɨχ qurha qɨɨr,	свиснув мальчика развернули	MED	hanowdɨ	boy	74.45168593375661	74.96095960196737	>1	sabajnuw χɨˤrbɨr Jahmiš qaaraj hanowdɨ,	один собирал ему груши	MED	hanowdɨ	boy	74.45168593375661	74.96095960196737	>1	sabajnuw χɨˤrbɨr Jahmiš qaaraj hanowdɨ,	один собирал ему груши	kna_pears_vdm_3.TextGrid	180
kna	2	0.9153755157064154	10	6.24180995494855	DIST	ADNOM	ANIM	protagonist	DIST_NP	ti χɨnimešis	boys	115.80015645743265	116.53333492804643	Haя ti χɨnimešis hanuw xibnowɨs xib χɨˤr hɨwɨraj.	тогда тем мальчикам троим три груши дал он	ZERO	qɨwɨr	boys	114.78599941125432	114.88478094172623	>1	šlʲapa qɨwɨr.	шляпу вернули	DIST	habišda	boys	108.94151072331503	109.5583465024841	>1	Haя ti χɨnimer diid ǯigɨj rɨˤɢaˤ šlʲapa agɨr habišda.	когда те мальчики шли по дороге находят шляпу они	kna_pears_vdm_3.TextGrid	180
kna	9	4.970836550088208	9	4.970836550088208	MED	INDEP	ANIM	protagonist	MED	hanuw	boy	116.53333492804643	116.99212025846043	Haя ti χɨnimešis hanuw xibnowɨs xib χɨˤr hɨwɨraj.	тогда тем мальчикам троим три груши дал он	DIST_NP	ti χɨnɨχ	boy	111.07078587072023	111.56249837795822	>1	Süt hawɨr ti χɨnɨχ qurha qɨɨr,	свиснув мальчика развернули	DIST_NP	ti χɨnɨχ	boy	111.07078587072023	111.56249837795822	>1	Süt hawɨr ti χɨnɨχ qurha qɨɨr,	свиснув мальчика развернули	kna_pears_vdm_3.TextGrid	180
kna	2	0.25463683410538707	2	0.25463683410538707	MED	INDEP	ANIM	secondary character	MED	hanuw	man2	31.929517177598978	32.232447204379525	Bejda xuʔ jirq'ɨr maddɨ edemi, hanuw ǯibra q'ičʷilkara χaj c'iʔ.	рядом проходит другой человек он за собой тащит козу	NP	maddɨ edemi	man2	30.78365142412474	31.67488034349359	1	Bejda xuʔ jirq'ɨr maddɨ edemi, hanuw ǯibra q'ičʷilkara χaj c'iʔ.	рядом проходит другой человек он за собой тащит козу	NP	maddɨ edemi	man2	30.78365142412474	31.67488034349359	1	Bejda xuʔ jirq'ɨr maddɨ edemi, hanuw ǯibra q'ičʷilkara χaj c'iʔ.	рядом проходит другой человек он за собой тащит козу	kna_pears_hdz_7.TextGrid	195
kna	5	3.827837553166134	5	3.827837553166134	MED	ADNOM	ANIM	secondary character	MED_NP	Ha edemi	man2	36.06028475754566	36.53443610381086	Ha edemi haˤrχɨˤr haя tiʔ.	этот человек прошел оттуда	MED	hanuw	man2	31.929517177598978	32.232447204379525	>1	Bejda xuʔ jirq'ɨr maddɨ edemi, hanuw ǯibra q'ičʷilkara χaj c'iʔ.	рядом проходит другой человек он за собой тащит козу	MED	hanuw	man2	31.929517177598978	32.232447204379525	>1	Bejda xuʔ jirq'ɨr maddɨ edemi, hanuw ǯibra q'ičʷilkara χaj c'iʔ.	рядом проходит другой человек он за собой тащит козу	kna_pears_hdz_7.TextGrid	195
kna	2	0.7639105023161576	11	7.874182071258247	PROX	INDEP	ANIM	protagonist	PROX	minowɨs	boy	56.88962857145403	57.315486725044074	Jiina rɨˤq'aˤ, minowɨs rɨˤq'a gɨˤrχɨˤr sa rɨš welisipeda hana riid.	уезжая по дороге ему встречается олна девушка на велосипеде	ZERO	Jiina	boy	56.06864429597632	56.125718069137875	>1	Jiina rɨˤq'aˤ, minowɨs rɨˤq'a gɨˤrχɨˤr sa rɨš welisipeda hana riid.	уезжая по дороге ему встречается олна девушка на велосипеде	SELF	jüǯ	boy	48.81788343925196	49.015446500195786	>1	Xele hagur [...] edemies jüǯ haǯargʷad,	потом увидев что человек не видит его	kna_pears_hdz_7.TextGrid	195
kna	5	1.9668500289519457	5	1.9668500289519457	DIST	INDEP	ANIM	secondary character	DIST	Tinowɨχda	girl	60.563670528515	61.08611506745536	Tinowɨχda gʲaɢara, minowdaa...	засмотревшись на нее, у него (с рук)	NP	sa rɨš	girl	58.26754873132333	58.59682049956305	1	Jiina rɨˤq'aˤ, minowɨs rɨˤq'a gɨˤrχɨˤr sa rɨš welisipeda hana riid.	уезжая по дороге ему встречается олна девушка на велосипеде	NP	sa rɨš	girl	58.26754873132333	58.59682049956305	1	Jiina rɨˤq'aˤ, minowɨs rɨˤq'a gɨˤrχɨˤr sa rɨš welisipeda hana riid.	уезжая по дороге ему встречается олна девушка на велосипеде	kna_pears_hdz_7.TextGrid	195
kna	1	1.0756211095831034	10	5.799213309954595	PROX	INDEP	ANIM	protagonist	PROX	minowdaa	boy	63.11470003499867	63.77324357147811	Tinowɨχda gʲaɢara, minowdaa...	засмотревшись на нее, у него (с рук)	ZERO	gʲaɢara	boy	61.85907702544452	62.039078925415566	>1	Tinowɨχda gʲaɢara, minowdaa...	засмотревшись на нее, у него (с рук)	PROX	minowɨs	boy	56.88962857145403	57.315486725044074	>1	Jiina rɨˤq'aˤ, minowɨs rɨˤq'a gɨˤrχɨˤr sa rɨš welisipeda hana riid.	уезжая по дороге ему встречается олна девушка на велосипеде	kna_pears_hdz_7.TextGrid	195
kna	21	11.455456440798507	21	11.455456440798507	PROX	INDEP	ANIM	protagonist	PROX	minowɨs	boy	75.22870001227662	75.6282164244075	Jahmiš q'ɨɨr minowɨs kumag hɨɨr,	собрав помогли ему	PROX	minowdaa	boy	63.11470003499867	63.77324357147811	>1	Tinowɨχda gʲaɢara, minowdaa...	засмотревшись на нее, у него (с рук)	PROX	minowdaa	boy	63.11470003499867	63.77324357147811	>1	Tinowɨχda gʲaɢara, minowdaa...	засмотревшись на нее, у него (с рук)	kna_pears_hdz_7.TextGrid	195
kna	5	5.8378538125028	5	5.8378538125028	PROX	INDEP	ANIM	protagonist	PROX	minuw	boy	89.92372485569334	90.5778781019296	Xele... minuw χɨnimešis sakar hɨwɨr diš, ti χɨnimer tiika dɨxɨr hargʷara, šlʲapa sejirani jiʔi.	потом... он мальчикам ничего не дал те мальчики туда пойдя  видят что шляпа валяется	SELF	jüǯ	boy	83.6512323091141	84.08587104319054	>1	haˤrχɨˤr χɨnɨχ, χɨnimer tiʔna haˤtχɨˤr, jüǯ [R dalьše] haˤrχɨˤr.	пошел мальчик мальчики туда ушли сам тоже дальше пошел	SELF	jüǯ	boy	83.6512323091141	84.08587104319054	>1	haˤrχɨˤr χɨnɨχ, χɨnimer tiʔna haˤtχɨˤr, jüǯ [R dalьše] haˤrχɨˤr.	пошел мальчик мальчики туда ушли сам тоже дальше пошел	kna_pears_hdz_7.TextGrid	195
kna	4	1.4136734583092192	4	1.4136734583092192	DIST	ADNOM	ANIM	protagonist	DIST_NP	ti χɨnimer	boys	92.88231468274701	93.41793009241695	Xele... minuw χɨnimešis sakar hɨwɨr diš, ti χɨnimer tiika dɨxɨr hargʷara, šlʲapa sejirani jiʔi.	потом... он мальчикам ничего не дал те мальчики туда пойдя  видят что шляпа валяется	NP	χɨnimešis	boys	90.94619668549743	91.46864122443779	>1	Xele... minuw χɨnimešis sakar hɨwɨr diš, ti χɨnimer tiika dɨxɨr hargʷara, šlʲapa sejirani jiʔi.	потом... он мальчикам ничего не дал те мальчики туда пойдя  видят что шляпа валяется	NP	χɨnimešis	boys	90.94619668549743	91.46864122443779	>1	Xele... minuw χɨnimešis sakar hɨwɨr diš, ti χɨnimer tiika dɨxɨr hargʷara, šlʲapa sejirani jiʔi.	потом... он мальчикам ничего не дал те мальчики туда пойдя  видят что шляпа валяется	kna_pears_hdz_7.TextGrid	195
kna	16	7.929045828277992	16	7.929045828277992	PROX	INDEP	ANIM	protagonist	PROX	minowda	boy	98.50692393020759	99.00741701793197	Haя leq'ešur šlʲapa minowda q'ɨwɨjne, hanuw hɨwɨr xib χɨˤr, xibdɨ χɨnχɨs xib χɨˤr hɨwɨr.	потом после того как вернули шляпу ему он дает троим три груши мальчикам  три груши дает	PROX	minuw	boy	89.92372485569334	90.5778781019296	>1	Xele... minuw χɨnimešis sakar hɨwɨr diš, ti χɨnimer tiika dɨxɨr hargʷara, šlʲapa sejirani jiʔi.	потом... он мальчикам ничего не дал те мальчики туда пойдя  видят что шляпа валяется	PROX	minuw	boy	89.92372485569334	90.5778781019296	>1	Xele... minuw χɨnimešis sakar hɨwɨr diš, ti χɨnimer tiika dɨxɨr hargʷara, šlʲapa sejirani jiʔi.	потом... он мальчикам ничего не дал те мальчики туда пойдя  видят что шляпа валяется	kna_pears_hdz_7.TextGrid	195
kna	2	0.46067985830863734	2	0.46067985830863734	MED	INDEP	ANIM	protagonist	MED	hanuw	boy	99.46809687624061	99.88078415910105	Haя leq'ešur šlʲapa minowda q'ɨwɨjne, hanuw hɨwɨr xib χɨˤr, xibdɨ χɨnχɨs xib χɨˤr hɨwɨr.	потом после того как вернули шляпу ему он дает троим три груши мальчикам  три груши дает	PROX	minowda	boy	98.50692393020759	99.00741701793197	>1	Haя leq'ešur šlʲapa minowda q'ɨwɨjne, hanuw hɨwɨr xib χɨˤr, xibdɨ χɨnχɨs xib χɨˤr hɨwɨr.	потом после того как вернули шляпу ему он дает троим три груши мальчикам  три груши дает	PROX	minowda	boy	98.50692393020759	99.00741701793197	>1	Haя leq'ešur šlʲapa minowda q'ɨwɨjne, hanuw hɨwɨr xib χɨˤr, xibdɨ χɨnχɨs xib χɨˤr hɨwɨr.	потом после того как вернули шляпу ему он дает троим три груши мальчикам  три груши дает	kna_pears_hdz_7.TextGrid	195
kna	16	4.605219543438849	17	7.126253690267404	PROX	INDEP	ANIM	protagonist	PROX	mid	boy	107.00703784936846	107.6058615417243	[R a] mid ǯudɨ müq'ʷaˤ q'aˤrχɨˤr.	а он в свое село пошел (поехал).	ZERO	hɨwɨr	boy	102.31401250106568	102.40181830592961	>1	Haя leq'ešur šlʲapa minowda q'ɨwɨjne, hanuw hɨwɨr xib χɨˤr, xibdɨ χɨnχɨs xib χɨˤr hɨwɨr.	потом после того как вернули шляпу ему он дает троим три груши мальчикам  три груши дает	MED	hanuw	boy	99.46809687624061	99.88078415910105	>1	Haя leq'ešur šlʲapa minowda q'ɨwɨjne, hanuw hɨwɨr xib χɨˤr, xibdɨ χɨnχɨs xib χɨˤr hɨwɨr.	потом после того как вернули шляпу ему он дает троим три груши мальчикам  три груши дает	kna_pears_hdz_7.TextGrid	195
kna	102	61.34366877438579	102	61.34366877438579	DIST	ADNOM	ANIM	protagonist	DIST_NP	ti edemi	man	110.16155221363775	110.69716762330769	[R A] ti edemi ula saʔ seq'eč'ur gʲaq'ɨd, karzina mabdiš.	а тот человек спускаясь с дерева вниз видит что карзины нет	NP	edemies	man	48.2866583198252	48.81788343925196	>1	Xele hagur [...] edemies jüǯ haǯargʷad,	потом увидев что человек не видит его	NP	edemies	man	48.2866583198252	48.81788343925196	>1	Xele hagur [...] edemies jüǯ haǯargʷad,	потом увидев что человек не видит его	kna_pears_hdz_7.TextGrid	195
