lang	ad	ad_seconds	wad	wad_seconds	dem	synt_pos	anim	role	anaphor_device	anaphor_form	anaphor_referent	anaphor_start	anaphor_end	anaphor_sentence_transcription	anaphor_sentence_translation	previous_device	previous_form	previous_referent	previous_start	previous_end	previous_mention	previous_sentence_transcription	previous_sentence_translation	previous_explicit_device	previous_explicit_form	previous_explicit_referent	previous_explicit_start	previous_explicit_end	previous_explicit_mention	previous_explicit_sentence_transcription	previous_explicit_sentence_translation	filename	length_words
mhb	1	0.7457711371317259	8	3.0477058109412667	DIST	ADNOM	INANIM	secondary character	DIST_NP	It šlaˤpa	hat	155.9567157445481	156.46602286258926	It šlaˤpa gibijaʁle it uršilini ʜaˤbal qʷaˤrʔ gib duhes išize, išdi calbeħ uršbeze.	Ту шляпу когда вернули тот мальчик три груши дал кажется ему, этим другим мальчикам	ZERO	gib	hat	155.16001389561225	155.21094460741637	>1	Helь šlaˤpara šwaˤt' baq'ile ilь wizaqile, ibaˤʜ gib.	Эту шапку тоже свистнули(не украли а засвистели держа саму шляпу) его остановили, обратно дали(вернули	MED_NP	Helь šlaˤpara	hat	152.32330674785948	152.90900993360682	>1	Helь šlaˤpara šwaˤt' baq'ile ilь wizaqile, ibaˤʜ gib.	Эту шапку тоже свистнули(не украли а засвистели держа саму шляпу) его остановили, обратно дали(вернули	mhb_pears_mgm_6.TextGrid	234
mhb	4	2.3708870468134933	8	3.635204254880051	DIST	ADNOM	ANIM	protagonist	DIST_NP	it uršilini	boy	157.6355865842894	158.2503930339248	It šlaˤpa gibijaʁle it uršilini ʜaˤbal qʷaˤrʔ gib duhes išize, išdi calbeħ uršbeze.	Ту шляпу когда вернули тот мальчик три груши дал кажется ему, этим другим мальчикам	ZERO	Ø	boy	155.21094460741637	155.2646995374759	>1	Helь šlaˤpara šwaˤt' baq'ile ilь wizaqile, ibaˤʜ gib.	Эту шапку тоже свистнули(не украли а засвистели держа саму шляпу) его остановили, обратно дали(вернули	MED	ilь	boy	153.81848693010892	154.00038232940935	>1	Helь šlaˤpara šwaˤt' baq'ile ilь wizaqile, ibaˤʜ gib.	Эту шапку тоже свистнули(не украли а засвистели держа саму шляпу) его остановили, обратно дали(вернули	mhb_pears_mgm_6.TextGrid	234
mhb	8	2.8557577690166056	23	10.492949174363218	PROX	ADNOM	ANIM	protagonist	PROX_NP	išdi calbeħ uršbeze	boys	160.01310363607456	161.30092306312156	It šlaˤpa gibijaʁle it uršilini ʜaˤbal qʷaˤrʔ gib duhes išize, išdi calbeħ uršbeze.	Ту шляпу когда вернули тот мальчик три груши дал кажется ему, этим другим мальчикам	ZERO	gibijaʁle	boys	157.0991393392818	157.15734586705796	>1	It šlaˤpa gibijaʁle it uršilini ʜaˤbal qʷaˤrʔ gib duhes išize, išdi calbeħ uršbeze.	Ту шляпу когда вернули тот мальчик три груши дал кажется ему, этим другим мальчикам	MED	ilьdilize	boys	149.0399506075582	149.52015446171134	>1	ʡuraʁa ilьdi uršbe ʡaˤrq'ulaˤʁe gub ilьdilize arbikibi išija q'aˤpa šlaˤpa.	Потом эти мальчики когда уходили увидели они упавшую его шляпу	mhb_pears_mgm_6.TextGrid	234
mhb	4	1.2566108514276664	4	1.2566108514276664	MED	INDEP	ANIM	protagonist	MED	ilьdira	boys	162.55753391454923	162.83765282947186	ʡuraʁa ilьdira bašuwe ħabalhas kuda q'uwe buʔubijalla ilьdi.	Потом они тоже пешком не знаю куда шли были они	PROX_NP	išdi calbeħ uršbeze	boys	160.01310363607456	161.30092306312156	>1	It šlaˤpa gibijaʁle it uršilini ʜaˤbal qʷaˤrʔ gib duhes išize, išdi calbeħ uršbeze.	Ту шляпу когда вернули тот мальчик три груши дал кажется ему, этим другим мальчикам	PROX_NP	išdi calbeħ uršbeze	boys	160.01310363607456	161.30092306312156	>1	It šlaˤpa gibijaʁle it uršilini ʜaˤbal qʷaˤrʔ gib duhes išize, išdi calbeħ uršbeze.	Ту шляпу когда вернули тот мальчик три груши дал кажется ему, этим другим мальчикам	mhb_pears_mgm_6.TextGrid	234
mhb	0	2.1427278037589588	0	2.1427278037589588	MED	INDEP	ANIM	protagonist	MED	ilьdi	boys	164.98038063323082	165.38055051169175	ʡuraʁa ilьdira bašuwe ħabalhas kuda q'uwe buʔubijalla ilьdi.	Потом они тоже пешком не знаю куда шли были они	MED	ilьdira	boys	162.55753391454923	162.83765282947186	>1	ʡuraʁa ilьdira bašuwe ħabalhas kuda q'uwe buʔubijalla ilьdi.	Потом они тоже пешком не знаю куда шли были они	MED	ilьdira	boys	162.55753391454923	162.83765282947186	>1	ʡuraʁa ilьdira bašuwe ħabalhas kuda q'uwe buʔubijalla ilьdi.	Потом они тоже пешком не знаю куда шли были они	mhb_pears_mgm_6.TextGrid	234
mhb	102	56.688120085555994	102	56.688120085555994	DIST	ADNOM	ANIM	protagonist	DIST_NP	it adami	man	168.06681181001753	168.58703265201675	A it adami čew warcur, ʡuraʁalla partukleħe darʔibi sik'al karzinkaleħe dixes.	А тот мужчина спустился, снова в фартук собравшиеся вещи в корзинку поставить	DIST	Itra	man	111.09129699356686	111.37869172446153	>1	Itra illiče ħule agʷire.	Он тоже на него не смотрел	DIST	Itra	man	111.09129699356686	111.37869172446153	>1	Itra illiče ħule agʷire.	Он тоже на него не смотрел	mhb_pears_mgm_6.TextGrid	234
mhb	1	0.15698107119243332	10	4.991713392994399	PROX	INDEP	ANIM	protagonist	PROX	Išize	man	173.57874604501114	173.88069240784984	Išize gub abzulla karzinart agʷara.	Он увидел что всех корзинок нет	ZERO	dixes	man	173.35628263007055	173.4217649738187	>1	A it adami čew warcur, ʡuraʁalla partukleħe darʔibi sik'al karzinkaleħe dixes.	А тот мужчина спустился, снова в фартук собравшиеся вещи в корзинку поставить	DIST_NP	it adami	man	168.06681181001753	168.58703265201675	>1	A it adami čew warcur, ʡuraʁalla partukleħe darʔibi sik'al karzinkaleħe dixes.	А тот мужчина спустился, снова в фартук собравшиеся вещи в корзинку поставить	mhb_pears_mgm_6.TextGrid	234
mhb	18	8.497149799172348	29	10.584831050871088	BELOW	ADNOM	ANIM	protagonist	BELOW_NP	Iχdi uršbera	boys	175.96538156256284	176.5474468403242	Iχdi uršbera ʡaˤrbaˤq'un haraq'ela, išis haraq'ela qʷaˤrʔra bukuwe.	Те мальчики тоже ушли спереди, перед ним грушу тоже кушая	ZERO	q'uwe	boys	167.31907753596417	167.4682317633905	>1	ʡaˤraʁa helь ʁʷet'la χaˤrʔudi q'uwe lebre.	Потом с тем деревом рядом проходили было	MED	ilьdi	boys	164.98038063323082	165.38055051169175	>1	ʡuraʁa ilьdira bašuwe ħabalhas kuda q'uwe buʔubijalla ilьdi.	Потом они тоже пешком не знаю куда шли были они	mhb_pears_mgm_6.TextGrid	234
mhb	9	4.052749983540366	9	4.052749983540366	PROX	INDEP	ANIM	protagonist	PROX	išis	man	177.9334423913902	178.39181879762725	Iχdi uršbera ʡaˤrbaˤq'un haraq'ela, išis haraq'ela qʷaˤrʔra bukuwe.	Те мальчики тоже ушли спереди, перед ним грушу тоже кушая	PROX	Išize	man	173.57874604501114	173.88069240784984	>1	Išize gub abzulla karzinart agʷara.	Он увидел что всех корзинок нет	PROX	Išize	man	173.57874604501114	173.88069240784984	>1	Išize gub abzulla karzinart agʷara.	Он увидел что всех корзинок нет	mhb_pears_mgm_6.TextGrid	234
mhb	5	4.286772933439266	5	4.286772933439266	PROX	INDEP	ANIM	protagonist	PROX	išize	man	182.67859173106652	183.02783089772333	ʡaˤraʁa išize arʁib duhesʡaˤj hinija arduχibijalla.	Потом он тоже понял наверно кто забрал	PROX	išis	man	177.9334423913902	178.39181879762725	>1	Iχdi uršbera ʡaˤrbaˤq'un haraq'ela, išis haraq'ela qʷaˤrʔra bukuwe.	Те мальчики тоже ушли спереди, перед ним грушу тоже кушая	PROX	išis	man	177.9334423913902	178.39181879762725	>1	Iχdi uršbera ʡaˤrbaˤq'un haraq'ela, išis haraq'ela qʷaˤrʔra bukuwe.	Те мальчики тоже ушли спереди, перед ним грушу тоже кушая	mhb_pears_mgm_6.TextGrid	234
mhb	2	0.5387080995024078	2	0.5387080995024078	MED	INDEP	ANIM	protagonist	MED	illija	man	17.69351557134718	18.057909661532474	illija buʔile leb baχča, kuta-kutaki χʷaˤlel ʁut'be	У него был сад, хорошие большие деревья	ONE_NP	ca adami	man	16.627972642661216	17.154807471844773	1	uʔile lew šaw ca adami	Был в ауле один мужчина	ONE_NP	ca adami	man	16.627972642661216	17.154807471844773	1	uʔile lew šaw ca adami	Был в ауле один мужчина	mhb_pears_zlm_9.TextGrid	472
mhb	12	9.156509305919133	12	9.156509305919133	DIST	INDEP	ANIM	protagonist	DIST	itija	man	27.214418967451607	27.750034377121555	qʷaˤrʔbela baχča buʔile leb itija, ʡaˤχil ʁut'bela	грушевый сад был у него. Хороших деревьев.	MED	illija	man	17.69351557134718	18.057909661532474	>1	illija buʔile leb baχča, kuta-kutaki χʷaˤlel ʁut'be	У него был сад, хорошие большие деревья	MED	illija	man	17.69351557134718	18.057909661532474	>1	illija buʔile leb baχča, kuta-kutaki χʷaˤlel ʁut'be	У него был сад, хорошие большие деревья	mhb_pears_zlm_9.TextGrid	472
mhb	4	0.6058600535610879	14	8.75672618998836	DIST	INDEP	ANIM	protagonist	DIST	ittini	man	36.506760567109914	36.8755449475384	duχile ler ittini sunesal dijal qʷaˤrʔbe dixes ʡaˤj,	понес он собой свои груши поставить,	ZERO	darʔa dakas	man	35.78675296722572	35.90090051354883	>1	waˤq'uwe lew ʡaˤj qʷaˤrʔbe darʔa dakas,	пошел собрать груши,	DIST	itija	man	27.214418967451607	27.750034377121555	>1	qʷaˤrʔbela baχča buʔile leb itija, ʡaˤχil ʁut'bela	грушевый сад был у него. Хороших деревьев.	mhb_pears_zlm_9.TextGrid	472
mhb	7	1.7209937753329427	28	15.338997027772663	DIST	INDEP	ANIM	protagonist	DIST	ittija	man	52.214541975311064	52.75454767522421	urcuwa daq'ibi ganzurbera duʔile ler ʡaˤj ittija speciʔalnɨj ʁut'beče iqul	деревянная лестница была у него специальная чтобы на деревья подниматься	ZERO	daˤqile	man	50.36622978292542	50.49354819997812	>1	ganzurbera daˤqile	лестницу тоже примкнув	DIST	ittini	man	36.506760567109914	36.8755449475384	>1	duχile ler ittini sunesal dijal qʷaˤrʔbe dixes ʡaˤj,	понес он собой свои груши поставить,	mhb_pears_zlm_9.TextGrid	472
mhb	8	3.6122992350516157	8	3.6122992350516157	MED	INDEP	INANIM	secondary character	MED	illa	ladder	55.345934999639084	55.620328139838854	illa duχile	Их тоже взяв	NP	ganzurbera	ladder	51.275974878460765	51.73363576458747	>1	urcuwa daq'ibi ganzurbera duʔile ler ʡaˤj ittija speciʔalnɨj ʁut'beče iqul	деревянная лестница была у него специальная чтобы на деревья подниматься	NP	ganzurbera	ladder	51.275974878460765	51.73363576458747	>1	urcuwa daq'ibi ganzurbera duʔile ler ʡaˤj ittija speciʔalnɨj ʁut'beče iqul	деревянная лестница была у него специальная чтобы на деревья подниматься	mhb_pears_zlm_9.TextGrid	472
mhb	6	2.209409042660809	31	15.979723319356701	DIST	INDEP	ANIM	protagonist	DIST	ittini	man	68.73427099458091	69.2193980664541	berdibi qʷaˤrʔ bixes buʔile leb ittini baq'ile fartuk heše haraq'edi	сорванную грушу поставить оказывается он сделал фартук здесь впереди	ZERO	dirʔuwe	man	66.45681245315055	66.5248619519201	>1	qʷaˤrʔbe [dirʔ=]	Груши со...	DIST	ittija	man	52.214541975311064	52.75454767522421	>1	urcuwa daq'ibi ganzurbera duʔile ler ʡaˤj ittija speciʔalnɨj ʁut'beče iqul	деревянная лестница была у него специальная чтобы на деревья подниматься	mhb_pears_zlm_9.TextGrid	472
mhb	2	2.001678353898413	10	3.158504625349437	DIST	INDEP	ANIM	secondary character	DIST	it	man2	100.35882542521806	100.58492537274266	ite χaˤrʔudi itebaˤʜ ʡaˤraˤq'uwe lew ʡaˤj it	и оттуда мимо прошел он	ZERO	lew	man2	98.13779342147215	98.35714707131964	>1	wak'ile lew ʡaˤj	Пришел	ONE_COMPLEX_NP	ca adami [eža=] ežaličul,	man2	93.34838693810394	97.20032079986862	1	wak'ile lew ʡaˤj ca adami [eža=] ežaličul, eža bugaqul adami	и пришел один мужчина с козой, козу кормящий мужчина	mhb_pears_zlm_9.TextGrid	472
mhb	46	23.389629479412918	46	23.389629479412918	DIST	INDEP	ANIM	protagonist	DIST	ittija	man	102.75381074649447	103.27845043055643	ʡaˤraʁa k'ʷiʔnes ittija itte ʁʷet'la χaˤrʔudi wak'ile lew ca urši lisibit'ičul	Потом дальше рядом, к его дереву пришел один мальчик с велосипедом	dist	ittini	man	79.10023045594168	79.36418126708155	>1	caʁidu darʔa dakibijaʁle ʡaˤj ittini	когда чуть собирал	dist	ittini	man	79.10023045594168	79.36418126708155	>1	caʁidu darʔa dakibijaʁle ʡaˤj ittini	когда чуть собирал	mhb_pears_zlm_9.TextGrid	472
mhb	1	0.17535658443389934	7	3.045463443319335	DIST	INDEP	ANIM	protagonist	DIST	ittini	boy	111.61804368389076	112.18439112526309	ittini ca karzina qʷaˤrʔbela arbuχile leb, diʡaˤl,	и он одну корзину с грушами забрал, тайно,	ZERO	warculle	boy	111.36585702020092	111.44268709945686	>1	čewra warculle	слез	NP	urši	boy	108.07220433840622	108.57258024057143	>1	urši čew warculle lew ittew,	Мальчик слез там,	mhb_pears_zlm_9.TextGrid	472
mhb	23	14.202013213863765	23	14.202013213863765	DIST	ADNOM	ANIM	protagonist	DIST_NP	it adamilizera	man	117.4804636444202	118.19611949298316	it adamilizera gʷa-ħagʷesle	так чтобы этот мужчина не заметил	DIST	ittija	man	102.75381074649447	103.27845043055643	>1	ʡaˤraʁa k'ʷiʔnes ittija itte ʁʷet'la χaˤrʔudi wak'ile lew ca urši lisibit'ičul	Потом дальше рядом, к его дереву пришел один мальчик с велосипедом	DIST	ittija	man	102.75381074649447	103.27845043055643	>1	ʡaˤraʁa k'ʷiʔnes ittija itte ʁʷet'la χaˤrʔudi wak'ile lew ca urši lisibit'ičul	Потом дальше рядом, к его дереву пришел один мальчик с велосипедом	mhb_pears_zlm_9.TextGrid	472
mhb	12	9.302384037154695	12	9.302384037154695	DIST	INDEP	ANIM	protagonist	DIST	ittini	boy	121.48677516241779	121.7841616656204	ittini arbuχile leb qʷaˤrʔbela karzina	он забрал корзину с грушами	DIST	ittini	boy	111.61804368389076	112.18439112526309	>1	ittini ca karzina qʷaˤrʔbela arbuχile leb, diʡaˤl,	и он одну корзину с грушами забрал, тайно,	DIST	ittini	boy	111.61804368389076	112.18439112526309	>1	ittini ca karzina qʷaˤrʔbela arbuχile leb, diʡaˤl,	и он одну корзину с грушами забрал, тайно,	mhb_pears_zlm_9.TextGrid	472
mhb	2	1.5454641592178717	9	6.733512100206312	DIST	INDEP	ANIM	protagonist	DIST	ittize	boy	128.51767376582671	128.93475133893037	ħunħer ittize cenħe dikile ler ca dursi lisibit'ičul	на дороге он встретил одну девочку на велосипеде	ZERO	ʡaˤrq'ulaˤʁle	boy	126.93269699442007	126.97220960660884	>1	ʡaˤrq'ulaˤʁle	когда уходил	DIST	ittini	boy	121.48677516241779	121.7841616656204	>1	ittini arbuχile leb qʷaˤrʔbela karzina	он забрал корзину с грушами	mhb_pears_zlm_9.TextGrid	472
mhb	3	0.5297040121186569	3	0.5297040121186569	DIST	ADNOM	ANIM	secondary character	DIST_NP	it dursilini	girl	132.43245554267543	133.31152464803492	it dursilini ittija beč'ičela arbikaqile leb šlapa,	Эта девочка уронила его шляпу,	ONE_NP	ca dursi lisibit'ičul	girl	129.896388889416	131.90275153055677	1	ħunħer ittize cenħe dikile ler ca dursi lisibit'ičul	на дороге он встретил одну девочку на велосипеде	ONE_NP	ca dursi lisibit'ičul	girl	129.896388889416	131.90275153055677	1	ħunħer ittize cenħe dikile ler ca dursi lisibit'ičul	на дороге он встретил одну девочку на велосипеде	mhb_pears_zlm_9.TextGrid	472
mhb	9	4.473359694454871	9	4.473359694454871	DIST	INDEP	ANIM	protagonist	DIST	ittija	boy	133.40811103338524	133.83396918697528	it dursilini ittija beč'ičela arbikaqile leb šlapa,	Эта девочка уронила его шляпу,	DIST	ittize	boy	128.51767376582671	128.93475133893037	>1	ħunħer ittize cenħe dikile ler ca dursi lisibit'ičul	на дороге он встретил одну девочку на велосипеде	DIST	ittize	boy	128.51767376582671	128.93475133893037	>1	ħunħer ittize cenħe dikile ler ca dursi lisibit'ičul	на дороге он встретил одну девочку на велосипеде	mhb_pears_zlm_9.TextGrid	472
mhb	6	2.4070540972174115	6	2.4070540972174115	DIST	INDEP	ANIM	protagonist	DIST	ittija	boy	136.2410232841927	136.4824892475685	[?] ittija beč'ičeb buʔubi šlapa	которая была у него на голове	DIST	ittija	boy	133.40811103338524	133.83396918697528	>1	it dursilini ittija beč'ičela arbikaqile leb šlapa,	Эта девочка уронила его шляпу,	DIST	ittija	boy	133.40811103338524	133.83396918697528	>1	it dursilini ittija beč'ičela arbikaqile leb šlapa,	Эта девочка уронила его шляпу,	mhb_pears_zlm_9.TextGrid	472
mhb	8	5.01150726815311	8	5.01150726815311	DIST	INDEP	ANIM	protagonist	DIST	ittizela	boy	141.49399651572162	142.04936823148597	ittizela sik'k'al baq'as ħabuhuble leb ʡaˤj itteb	он ничего сделать тоже не смог там	DIST	ittija	boy	136.2410232841927	136.4824892475685	>1	[?] ittija beč'ičeb buʔubi šlapa	которая была у него на голове	DIST	ittija	boy	136.2410232841927	136.4824892475685	>1	[?] ittija beč'ičeb buʔubi šlapa	которая была у него на голове	mhb_pears_zlm_9.TextGrid	472
mhb	7	2.5019553880340197	7	2.5019553880340197	DIST	INDEP	ANIM	protagonist	DIST	ittizeb	boy	144.55132361952	145.11556146675957	ittizeb lebre ʡaˤj welоsipedra haraq'eb karzinara	у него был и велосипед	DIST	ittizela	boy	141.49399651572162	142.04936823148597	>1	ittizela sik'k'al baq'as ħabuhuble leb ʡaˤj itteb	он ничего сделать тоже не смог там	DIST	ittizela	boy	141.49399651572162	142.04936823148597	>1	ittizela sik'k'al baq'as ħabuhuble leb ʡaˤj itteb	он ничего сделать тоже не смог там	mhb_pears_zlm_9.TextGrid	472
mhb	11	5.055288176220614	11	5.055288176220614	DIST	INDEP	ANIM	protagonist	DIST	ittizela	boy	150.1708496429802	150.85428989959607	ittizela sik'k'al baq'asra ħabuhuble	поэтому ничего сделать не смог	DIST	ittizeb	boy	144.55132361952	145.11556146675957	>1	ittizeb lebre ʡaˤj welоsipedra haraq'eb karzinara	у него был и велосипед	DIST	ittizeb	boy	144.55132361952	145.11556146675957	>1	ittizeb lebre ʡaˤj welоsipedra haraq'eb karzinara	у него был и велосипед	mhb_pears_zlm_9.TextGrid	472
mhb	1	0.12073298168789393	10	4.510974537818981	DIST	INDEP	ANIM	protagonist	DIST	ittija	boy	155.36526443741505	155.73843910808674	ittija welоsiped buquwe leb ca ʁarʁalize	его велосипед столкнулся об один камень	ZERO	waʔarijal	boy	155.1984334081736	155.24453145572716	>1	caʁidu ittebaˤʜ waʔarijal	Когда еще проехал	DIST	ittizela	boy	150.1708496429802	150.85428989959607	>1	ittizela sik'k'al baq'asra ħabuhuble	поэтому ничего сделать не смог	mhb_pears_zlm_9.TextGrid	472
mhb	2	0.8766189349439912	2	0.8766189349439912	MED	ADNOM	ANIM	protagonist	MED_NUM_NP	heldi ʜaˤballa uršilini	boys	170.6943547006881	172.0465640955926	heldi ʜaˤballa uršilini akkuratnо qʷaˤrʔbera darʔa dakile	Эти три мальчика аккуратно груши тоже собрали	NUM_NP	ʜaˤbal urši	boys	168.976995184172	169.81773576574412	1	ʡuraʁa helle aqu bak'ile leb ʡaˤj ʜaˤbal urši	Потом туда пришли три мальчика	NUM_NP	ʜaˤbal urši	boys	168.976995184172	169.81773576574412	1	ʡuraʁa helle aqu bak'ile leb ʡaˤj ʜaˤbal urši	Потом туда пришли три мальчика	mhb_pears_zlm_9.TextGrid	472
mhb	41	22.041242956464032	41	22.041242956464032	DIST	ADNOM	ANIM	protagonist	DIST_NP	it urši	boy	182.50075613883945	182.9200288570647	hunew wattule lew ʡaˤj it urši	проводили этого мальчика	NP	urši	boy	160.18512004217564	160.45951318237542	>1	i arikile lew urši welоsipedičela,	и упал мальчик с велосипеда,	NP	urši	boy	160.18512004217564	160.45951318237542	>1	i arikile lew urši welоsipedičela,	и упал мальчик с велосипеда,	mhb_pears_zlm_9.TextGrid	472
mhb	4	1.5533976702096766	4	1.5533976702096766	DIST	INDEP	ANIM	protagonist	DIST	itra	boy	184.47342652727437	184.84440605282447	hunew wattule itra	Проводили его и уходили,	DIST_NP	it urši	boy	182.50075613883945	182.9200288570647	>1	hunew wattule lew ʡaˤj it urši	проводили этого мальчика	DIST_NP	it urši	boy	182.50075613883945	182.9200288570647	>1	hunew wattule lew ʡaˤj it urši	проводили этого мальчика	mhb_pears_zlm_9.TextGrid	472
mhb	95	52.217922299225734	95	52.217922299225734	DIST	ADNOM	INANIM	secondary character	DIST_NP	it arbikibi šlaˤpa	hat	190.18645117123148	191.66018757104894	uršbeze bargib ʡaˤj it arbikibi šlaˤpa	мальчики нашли его шляпу которую он уронил	NP	šlapa	hat	137.3470797575413	137.96852887200575	>1	[?] ittija beč'ičeb buʔubi šlapa	которая была у него на голове	NP	šlapa	hat	137.3470797575413	137.96852887200575	>1	[?] ittija beč'ičeb buʔubi šlapa	которая была у него на голове	mhb_pears_zlm_9.TextGrid	472
mhb	19	11.579791440038917	19	11.579791440038917	MED	INDEP	ANIM	protagonist	MED	il	boy	196.42419749286339	196.58224794161845	wizur il,	и он остановился,	DIST	itra	boy	184.47342652727437	184.84440605282447	>1	hunew wattule itra	Проводили его и уходили,	DIST	itra	boy	184.47342652727437	184.84440605282447	>1	hunew wattule itra	Проводили его и уходили,	mhb_pears_zlm_9.TextGrid	472
mhb	3	0.6884284986871592	3	0.6884284986871592	DIST	INDEP	ANIM	protagonist	DIST	it	boy	197.2706764403056	197.4243040554162	wizur ʡaˤj it	остановился он	MED	il	boy	196.42419749286339	196.58224794161845	>1	wizur il,	и он остановился,	MED	il	boy	196.42419749286339	196.58224794161845	>1	wizur il,	и он остановился,	mhb_pears_zlm_9.TextGrid	472
mhb	5	2.70334923842168	5	2.70334923842168	DIST	INDEP	ANIM	protagonist	DIST	it	boy	200.12765329383788	200.3252163547817	uže welоsipedičew it kad ħajib,	Уже на велосипед он не сел,	DIST	it	boy	197.2706764403056	197.4243040554162	>1	wizur ʡaˤj it	остановился он	DIST	it	boy	197.2706764403056	197.4243040554162	>1	wizur ʡaˤj it	остановился он	mhb_pears_zlm_9.TextGrid	472
mhb	3	0.801722677525305	3	0.801722677525305	DIST	INDEP	ANIM	protagonist	DIST	ittija	boy	201.126939032307	201.34051411249948	ittija lebre dagara izuwe,	у него была и нога повреждена,	DIST	it	boy	200.12765329383788	200.3252163547817	>1	uže welоsipedičew it kad ħajib,	Уже на велосипед он не сел,	DIST	it	boy	200.12765329383788	200.3252163547817	>1	uže welоsipedičew it kad ħajib,	Уже на велосипед он не сел,	mhb_pears_zlm_9.TextGrid	472
mhb	4	1.1683615876845295	4	1.1683615876845295	DIST	INDEP	ANIM	protagonist	DIST	ittini	boy	202.508875700184	202.74156108307344	ittini welоsiped bukib	он велосипед повел	DIST	ittija	boy	201.126939032307	201.34051411249948	>1	ittija lebre dagara izuwe,	у него была и нога повреждена,	DIST	ittija	boy	201.126939032307	201.34051411249948	>1	ittija lebre dagara izuwe,	у него была и нога повреждена,	mhb_pears_zlm_9.TextGrid	472
